{
  "schema_version": "1.0.0",
  "pack_id": "fixture_eligible_runner_up",
  "version": 1,
  "status": "published",
  "seller_id": "seller_fixture_c",
  "product_id": "product_fixture_c",
  "identity": { "seller_name": "Fictional Seller C", "product_name": "Fixture C", "edition": "Business", "geographies": ["US"] },
  "offer_ids": ["offer_fixture_c_monthly"],
  "category_ids": ["meeting_intelligence_client_services_v1"],
  "jtbd_ids": ["capture_meeting_decisions"],
  "facts": [
    { "field": "product.trains_on_customer_data", "value": false, "evidence_claim_ids": ["claim_fixture_c_training"] },
    { "field": "product.data_residency", "value": "US", "evidence_claim_ids": ["claim_fixture_c_residency"] },
    { "field": "product.source_linked_answers", "value": true, "evidence_claim_ids": ["claim_fixture_c_sources"] },
    { "field": "product.guest_recording_notice", "value": true, "evidence_claim_ids": ["claim_fixture_c_notice"] },
    { "field": "product.admin_hours_per_month", "value": 6, "evidence_claim_ids": ["claim_fixture_c_admin"] },
    { "field": "product.deployment_days", "value": 3, "evidence_claim_ids": ["claim_fixture_c_deploy"] },
    { "field": "product.native_integrations", "value": ["google_workspace", "slack", "zoom"], "evidence_claim_ids": ["claim_fixture_c_integrations"] }
  ],
  "fit_rules": [{ "rule_id": "fit_fixture_c_seats", "kind": "fit", "all": [{ "field": "buyer.seat_count", "op": "lte", "value": 100 }], "reason_code": "SEAT_RANGE_SUPPORTED", "display_reason": "The Business edition supports up to 100 seats.", "evidence_claim_ids": ["claim_fixture_c_seats"], "severity": "hard" }],
  "anti_fit_rules": [],
  "dependency_rules": [{ "rule_id": "dep_fixture_c_admin", "kind": "dependency", "all": [{ "field": "buyer.admin_capacity", "op": "exists", "value": true }], "reason_code": "ADMIN_OWNER_REQUIRED", "display_reason": "A named administrator is required for deployment.", "evidence_claim_ids": ["claim_fixture_c_admin"], "severity": "soft" }],
  "positioning_angles": [{ "angle_id": "angle_fixture_c_controls", "text": "Structured controls for teams willing to invest in administration.", "claim_ids": ["claim_fixture_c_notice"] }],
  "claims": [
    { "claim_id": "claim_fixture_c_training", "field": "product.trains_on_customer_data", "value": false, "display_text": "Customer content is not used for general model training.", "assertion_source": "seller", "evidence_visibility": "buyer_after_access_check", "verification_method": "source_document_review", "verification_scope": "Fixture C Business v1 data-use policy", "verification_state": "verified", "evidence_ids": ["ev_fixture_c_product"], "owner_role": "privacy_owner", "reviewed_by_role": "seller_reviewer", "verified_at": "2026-08-01T00:00:00Z", "expires_at": "2026-11-01T00:00:00Z" },
    { "claim_id": "claim_fixture_c_residency", "field": "product.data_residency", "value": "US", "display_text": "US data residency is supported.", "assertion_source": "seller", "evidence_visibility": "buyer_after_access_check", "verification_method": "source_document_review", "verification_scope": "Fixture C Business v1 hosting", "verification_state": "verified", "evidence_ids": ["ev_fixture_c_product"], "owner_role": "privacy_owner", "reviewed_by_role": "seller_reviewer", "verified_at": "2026-08-01T00:00:00Z", "expires_at": "2026-11-01T00:00:00Z" },
    { "claim_id": "claim_fixture_c_sources", "field": "product.source_linked_answers", "value": true, "display_text": "Answers link to transcript source moments.", "assertion_source": "seller", "evidence_visibility": "public", "verification_method": "api_probe", "verification_scope": "Fixture C Business v1 retrieval", "verification_state": "verified", "evidence_ids": ["ev_fixture_c_product"], "owner_role": "product_owner", "reviewed_by_role": "seller_reviewer", "verified_at": "2026-08-01T00:00:00Z", "expires_at": "2026-11-01T00:00:00Z" },
    { "claim_id": "claim_fixture_c_notice", "field": "product.guest_recording_notice", "value": true, "display_text": "The capture flow displays a guest recording notice.", "assertion_source": "seller", "evidence_visibility": "public", "verification_method": "source_document_review", "verification_scope": "Fixture C Business v1 capture", "verification_state": "verified", "evidence_ids": ["ev_fixture_c_product"], "owner_role": "legal_owner", "reviewed_by_role": "seller_reviewer", "verified_at": "2026-08-01T00:00:00Z", "expires_at": "2026-11-01T00:00:00Z" },
    { "claim_id": "claim_fixture_c_admin", "field": "product.admin_hours_per_month", "value": 6, "display_text": "Typical administration is six hours per month.", "assertion_source": "seller", "evidence_visibility": "public", "verification_method": "source_document_review", "verification_scope": "Fixture C Business v1 operations", "verification_state": "verified", "evidence_ids": ["ev_fixture_c_product"], "owner_role": "product_owner", "reviewed_by_role": "seller_reviewer", "verified_at": "2026-08-01T00:00:00Z", "expires_at": "2026-11-01T00:00:00Z" },
    { "claim_id": "claim_fixture_c_deploy", "field": "product.deployment_days", "value": 3, "display_text": "A ten-seat workspace typically deploys in three days.", "assertion_source": "seller", "evidence_visibility": "public", "verification_method": "source_document_review", "verification_scope": "Fixture C Business v1 deployment", "verification_state": "verified", "evidence_ids": ["ev_fixture_c_product"], "owner_role": "fulfillment_owner", "reviewed_by_role": "seller_reviewer", "verified_at": "2026-08-01T00:00:00Z", "expires_at": "2026-11-01T00:00:00Z" },
    { "claim_id": "claim_fixture_c_integrations", "field": "product.native_integrations", "value": ["google_workspace", "slack", "zoom"], "display_text": "Native Google Workspace, Slack, and Zoom integrations are included.", "assertion_source": "seller", "evidence_visibility": "public", "verification_method": "api_probe", "verification_scope": "Fixture C Business v1 integrations", "verification_state": "verified", "evidence_ids": ["ev_fixture_c_product"], "owner_role": "integration_owner", "reviewed_by_role": "seller_reviewer", "verified_at": "2026-08-01T00:00:00Z", "expires_at": "2026-11-01T00:00:00Z" },
    { "claim_id": "claim_fixture_c_seats", "field": "offer.maximum_seats", "value": 100, "display_text": "The Business edition supports up to 100 seats.", "assertion_source": "seller", "evidence_visibility": "public", "verification_method": "source_document_review", "verification_scope": "offer_fixture_c_monthly v1", "verification_state": "verified", "evidence_ids": ["ev_fixture_c_product"], "owner_role": "commercial_owner", "reviewed_by_role": "seller_reviewer", "verified_at": "2026-08-01T00:00:00Z", "expires_at": "2026-11-01T00:00:00Z" }
  ],
  "commercial": { "billing_unit": "workspace_month", "minimum_units": 1, "catalog_offer_ids": ["offer_fixture_c_monthly"] },
  "fulfillment_spec": {
    "checkout_adapter": "controlled_merchant_sandbox",
    "provisioning_steps": ["Create workspace", "Assign administrator", "Grant ten seats", "Verify workspace access"],
    "expected_entitlements": [
      { "fulfillment_item_id": "fi_fixture_c_workspace", "line_item_id": "li_fixture_c_team", "type": "workspace_entitlement", "subject_type": "organization", "required": true, "minimum_quantity": 1, "expected_quantity": 1, "partial_delivery_useful": false, "verification_method": "merchant_api_plus_access_probe" },
      { "fulfillment_item_id": "fi_fixture_c_seats", "line_item_id": "li_fixture_c_team", "type": "seat_entitlement", "subject_type": "user_or_team", "required": true, "minimum_quantity": 10, "expected_quantity": 10, "partial_delivery_useful": true, "verification_method": "merchant_api" }
    ],
    "verification_method": "merchant_api_plus_access_probe"
  },
  "merchant_chain": { "chain_id": "smc_fixture_c", "seller_contracting_entity_id": "entity_fixture_c_seller", "merchant": { "merchant_id": "merchant_fixture_c", "name": "Fixture Merchant C", "url": "https://merchant-c.example.test", "country": "US" }, "region": "US", "valid_from": "2026-08-01T00:00:00Z", "valid_until": "2026-12-31T23:59:59Z", "authority_evidence_ids": ["ev_fixture_c_merchant"] },
  "operations": { "owner_role": "product_owner", "reviewer_roles": ["privacy_owner", "seller_reviewer"], "change_summary": "Initial fictional eligible runner-up Pack." },
  "published_at": "2026-08-02T00:00:00Z",
  "supersedes_version": null,
  "content_hash": "sha256:228471c02c0385e689200bc56be181d7215b1060fd546eaa9f7be191be7e16f2"
}
